### ISSUE TITLE
Remote suricata data to SELKS5

### ISSUE THREAD

**Issue by jonesthesubmarine** [StamusNetworks/SELKS#162]
Using SELKS5 in Azure no problems. Since Azure has no network tap to speak of we want to run suricata on our servers and have them send the data to SELKS5.

My server is CentOS7
I'm running suricata like this;
/usr/sbin/suricata -c /etc/suricata/suricata.yaml -i ens192

my config (output section);
suricata.yaml
`outputs:
  - fast:
      enabled: no
      filename: fast.log
      append: yes
  - eve-log:
      enabled: yes
      filetype: regular #regular|syslog|unix_dgram|unix_stream|redis
      filename: eve.json`

I installed filebeat on CentOS.
cat /etc/filebeat/filebeat.yml

`filebeat.inputs:
- type: log
  enabled: true
  paths:
   - /var/log/suricata/eve.json
filebeat.config.modules:
  path: ${path.config}/modules.d/*.yml
  reload.enabled: false
setup.template.settings:
  index.number_of_shards: 3
setup.kibana:
output.logstash:
  hosts: ["10.0.4.27:5044"]
processors:
  - add_host_metadata: ~
  - add_cloud_metadata: ~
logging.files:
  path: /var/log/filebeat
  name: filebeat.log
  keepfiles: 7`

On the SELKS5 box I added the file /etc/logstash/conf.d/02-beats-input.conf;
`input {
  beats {
    port => 5044
  }
}`

From the SELKS5 box I can see the traffic coming in from the CentOS box via tcpdump. The port is open and listening.

However, I am not seeing anything in my kibana. I go to discover and filter by host and all I see is 0.0.0.0 not my CentOS IP.

Any help would be appreciated. Thanks

**Comment by pevma** [comment]
If there is no data in Kibana it means most likely something is not working with the shipping. Any info in`/var/log/logstash` ? Did you check firewall opening etc ?

**Comment by jonesthesubmarine** [comment]
Here is a message that is repeated over and over in /var/log/logstash/logstash-plain.log on the SELKS5 box:

`[2019-03-08T10:03:37,087][WARN ][logstash.outputs.elasticsearch] Could not index event to Elasticsearch. {:status=>400, :action=>["index", {:_id=>nil, :_index=>"logstash-2019.03.08", :_type=>"doc", :routing=>nil}, #<LogStash::Event:0x6617219d>], :response=>{"index"=>{"_index"=>"logstash-2019.03.08", "_type"=>"doc", "_id"=>"EOeLXGkBS3iqHvYfJlZ9", "status"=>400, "error"=>{"type"=>"mapper_parsing_exception", "reason"=>"failed to parse field [host] of type [text]", "caused_by"=>{"type"=>"illegal_state_exception", "reason"=>"Can't get text on a START_OBJECT at 1:2272"}}}}}`

No firewall enabled on either host. Here is the tcpdump output from the SELKS5 box:
`root@SELKS:~# tcpdump -i ens192 host 10.0.4.29
tcpdump: verbose output suppressed, use -v or -vv for full protocol decode
listening on ens192, link-type EN10MB (Ethernet), capture size 262144 bytes
10:09:44.624812 IP 10.0.4.29.59534 > 10.0.4.27.5044: Flags [P.], seq 3852499833:3852501109, ack 1948862241, win 229, options [nop,nop,TS val 3796393048 ecr 949105020], length 1276
10:09:44.625909 IP 10.0.4.27.5044 > 10.0.4.29.59534: Flags [P.], seq 1:7, ack 1276, win 363, options [nop,nop,TS val 949106770 ecr 3796393048], length 6
10:09:44.626059 IP 10.0.4.29.59534 > 10.0.4.27.5044: Flags [.], ack 7, win 229, options [nop,nop,TS val 3796393050 ecr 949106770], length 0
10:09:51.626865 IP 10.0.4.29.59534 > 10.0.4.27.5044: Flags [P.], seq 1276:2534, ack 7, win 229, options [nop,nop,TS val 3796400050 ecr 949106770], length 1258
10:09:51.628005 IP 10.0.4.27.5044 > 10.0.4.29.59534: Flags [P.], seq 7:13, ack 2534, win 363, options [nop,nop,TS val 949108521 ecr 3796400050], length 6
10:09:51.628208 IP 10.0.4.29.59534 > 10.0.4.27.5044: Flags [.], ack 13, win 229, options [nop,nop,TS val 3796400052 ecr 949108521], length 0`

**Comment by pevma** [comment]
Did you double check if you are using the correct templates? (here is what selks5 uses - https://github.com/StamusNetworks/SELKS/tree/SELKS5/staging/etc/logstash )

**Comment by jonesthesubmarine** [comment]
That looks like the index template in kibana. I am using the official ISO and all that was already setup.

On my CentOS box I just installed filebeat and suricata with the details above. Did I miss something?
