### ISSUE TITLE
Selks 4.0 no alerts

### ISSUE THREAD

**Issue by dracmic** [StamusNetworks/SELKS#127]
Hello,

I have installed Selks as virtual machine to which I am sending netflow data which is not seen on interface, I think.
Indices in elasticsearch: 

logstash-2018.09.07 | 42034 | 0
-- | -- | --
netflow-2018.09.07 | 46219 | 0

logstash-2018.09.07 | 50549 | 0
-- | -- | --
netflow-2018.09.07 | 54878 | 0
logstash-tls-2018.09.07 | 162 | 0
logstash-flow-2018.09.07 | 3874 | 0
.kibana | 250 | 0
logstash-dns-2018.09.07 | 49 | 0
logstash-fileinfo-2018.09.07 | 4 | 0
logstash-http-2018.09.07 | 4 | 0

I already tried the fixes for logstash which is working and listening udp on 30002 and receiving traffic.

Could you please help me out?

Best regards.

**Comment by pevma** [comment]
> On 7 Sep 2018, at 23:25, dracmic <notifications@github.com> wrote:
> 
> Hello,
> 
> I have installed Selks as virtual machine to which I am sending netflow data which is
> 

How are you sending the netflow data?


> not seen on interface, I think.
> 

If you check with tcpdump would you see it on the interface ?


> Indices in elasticsearch:
> 
> logstash-2018.09.07	42034	0
> netflow-2018.09.07	46219	0


You should probably set up Kibana indexes for that from the settings.
The default set up is to digest “logstash-*-..”

**Comment by dracmic** [comment]
Hello pevma,

I was doing reference to the web interface of selks and SN Alerts in Kibana. I think is because somehow logstash is inserting data in elasticsearch without logstash-"something". But it is my first experience with ELK stack in this way. I am sending the data from Ubiquiti ER PRO 8 which has commands for netflow v5, v9 and v10. Tcpdump:

root@selks-ips:~# tcpdump -ni ens18 port 30002
tcpdump: verbose output suppressed, use -v or -vv for full protocol decode
listening on ens18, link-type EN10MB (Ethernet), capture size 262144 bytes
09:26:05.955824 IP 172.30.241.17.40917 > 192.168.30.81.30002: UDP, length 504
09:26:05.955886 IP 172.30.241.17.40917 > 192.168.30.81.30002: UDP, length 84
09:26:06.230762 IP 172.30.241.17.40917 > 192.168.30.81.30002: UDP, length 504
09:26:06.230806 IP 172.30.241.17.40917 > 192.168.30.81.30002: UDP, length 84
09:26:06.491286 IP 172.30.241.17.40917 > 192.168.30.81.30002: UDP, length 504
09:26:06.513386 IP 172.30.241.5.38400 > 192.168.30.81.30002: UDP, length 496
09:26:06.513419 IP 172.30.241.5.38400 > 192.168.30.81.30002: UDP, length 496
09:26:06.513442 IP 172.30.241.5.38400 > 192.168.30.81.30002: UDP, length 496
09:26:06.513446 IP 172.30.241.5.38400 > 192.168.30.81.30002: UDP, length 260
09:26:06.538944 IP 172.30.241.17.40917 > 192.168.30.81.30002: UDP, length 144
09:26:06.738862 IP 172.30.241.17.40917 > 192.168.30.81.30002: UDP, length 384
09:26:06.833801 IP 172.30.241.17.40917 > 192.168.30.81.30002: UDP, length 324

Thanks

**Comment by pevma** [comment]
> On 8 Sep 2018, at 08:31, dracmic <notifications@github.com> wrote:
> 
> Hello pevma,
> 
> I was doing reference to the web interface of selks and SN Alerts in Kibana. I think is because somehow logstash is inserting data in elasticsearch without logstash-
> 
Yes that is the reason.
So I was referring if you can enable/add that to the Kibana indexes settings  - it would show up as data under “Discover” in Kibana. Then you would probably need to add your own dashboard based on that index (“netflow-*” in this case). For example: the SN DNS dashboard is based of the index “logstash-dns*” and so on.
It would not necessarily show up under SN-Alerts - as there maybe no alerts.


> "something". But it is my first experience with ELK stack in this way. I am sending the data from Ubiquiti ER PRO 8 which has commands for netflow v5, v9 and v10. Tcpdump:
> 

Actually Suricata can do glow/netflow logging itself. So if you have already mirrored the traffic  it would/should probably be in logstash-flow/netflow.

**Comment by pevma** [comment]
Ok
Is the logstash/Elasticsearch services tuning ?
Anything in the /var/log/logstash/ logs ?

Thank you 

> -- 
> Regards,
> Peter Manev

**Comment by pevma** [comment]
Sorry - you mentioned already that logstash is inverting into elastic - how do you confirm that ?

> -- 
> Regards,
> Peter Manev

**Comment by dracmic** [comment]
Take a look on screenshots. I reset them this morning and before rebooted.

![scirius1](https://user-images.githubusercontent.com/4908273/46335597-a3954a00-c630-11e8-80ee-90f98df1e149.PNG)
![scirius2](https://user-images.githubusercontent.com/4908273/46335598-a3954a00-c630-11e8-8f8e-5f9f2e58c119.png)

**Comment by pevma** [comment]
Ok
So those alerts - do not display in Kibana as well ?

> -- 
> Regards,
> Peter Manev

**Comment by dracmic** [comment]
Yes, pevma is correct no kibana and no scirius.

**Comment by pevma** [comment]
Is there any pointers in the Elasticsearch or Logstash logs ? 
If the logs are inserted - Kibana is the visualisation part - so they should be there - unless there is something in the logs ?

> -- 
> Regards,
> Peter Manev

**Comment by dracmic** [comment]
curl http://localhost:9200/_aliases?pretty=1
{
  "logstash-fileinfo-2018.10.01" : {
    "aliases" : { }
  },
  "logstash-tls-2018.10.01" : {
    "aliases" : { }
  },
  "logstash-http-2018.10.01" : {
    "aliases" : { }
  },
  "logstash-ssh-2018.10.01" : {
    "aliases" : { }
  },
  "logstash-alert-2018.10.01" : {
    "aliases" : { }
  },
  "logstash-smtp-2018.10.01" : {
    "aliases" : { }
  },
  "logstash-2018.10.01" : {
    "aliases" : { }
  },
  "logstash-flow-2018.10.01" : {
    "aliases" : { }
  },
  "logstash-dns-2018.10.01" : {
    "aliases" : { }
  },
  ".kibana" : {
    "aliases" : { }
  },
  "logstash-2018.10.02" : {
    "aliases" : { }
  }
}
root@sniffer:~# curl 'localhost:9200/_cat/indices?v'
health status index                        uuid                   pri rep docs.count docs.deleted store.size pri.store.size
green  open   logstash-tls-2018.10.01      n2s7IcJ8T5-9qYFiiJlGtw   5   0      18301            0     26.8mb         26.8mb
green  open   logstash-fileinfo-2018.10.01 WIas5cu0RXO5MWhmNQ5tPw   5   0       5719            0       13mb           13mb
green  open   logstash-http-2018.10.01     6aNe2GEQRBiA4uch7A2qsQ   5   0       7330            0     12.1mb         12.1mb
green  open   logstash-ssh-2018.10.01      jksfT3sTT9KfoZtjmVcG5Q   5   0        260            0      1.1mb          1.1mb
green  open   logstash-smtp-2018.10.01     vRIkiM_hToyg7e-R8bLEyA   5   0        107            0      1.2mb          1.2mb
green  open   logstash-alert-2018.10.01    pB3lLwcuSKi2JufbYVXLBw   5   0       6931            0       15mb           15mb
green  open   logstash-flow-2018.10.01     mG4GHIVTR6WXyCRw4FCUbw   5   0    3525136            0      2.7gb          2.7gb
green  open   logstash-2018.10.01          eZSYCbOKSY6adfTzseTqHA   5   0       1749            0      9.5mb          9.5mb
green  open   logstash-dns-2018.10.01      nepUayKMQW-lxoxYqO4B2w   5   0     575959            0    261.9mb        261.9mb
green  open   .kibana                      5TdmH0kHS0uAtOvHCqnL4g   1   0        249            0    254.3kb        254.3kb
green  open   logstash-2018.10.02          BUVXWhumStGd4XZ846xj3Q   5   0        846            0    649.6kb        649.6kb

**Comment by dracmic** [comment]
Logstash-plain(last restart and reset of indices):

[2018-10-02T14:46:52,048][INFO ][logstash.outputs.elasticsearch] Elasticsearch pool URLs updated {:changes=>{:removed=>[], :added=>[http://127.0.0.1:9200/]}}
[2018-10-02T14:46:52,048][INFO ][logstash.outputs.elasticsearch] Running health check to see if an Elasticsearch connection is working {:healthcheck_url=>http://127.0.0.1:9200/, :path=>"/"}
[2018-10-02T14:46:52,051][WARN ][logstash.outputs.elasticsearch] Restored connection to ES instance {:url=>"http://127.0.0.1:9200/"}
[2018-10-02T14:46:52,053][INFO ][logstash.outputs.elasticsearch] Using mapping template from {:path=>"/etc/logstash/elasticsearch5-template.json"}
[2018-10-02T14:46:52,055][INFO ][logstash.outputs.elasticsearch] Attempting to install template {:manage_template=>{"template"=>"logstash-*", "version"=>50001, "settings"=>{"number_of_replicas"=>0, "index.refresh_interval"=>"5s"}, "mappings"=>{"_default_"=>{"_all"=>{"enabled"=>true, "norms"=>false}, "dynamic_templates"=>[{"message_field"=>{"path_match"=>"message", "match_mapping_type"=>"string", "mapping"=>{"type"=>"text", "norms"=>false}}}, {"string_fields"=>{"match"=>"*", "match_mapping_type"=>"string", "mapping"=>{"type"=>"text", "norms"=>false, "fields"=>{"keyword"=>{"type"=>"keyword", "index"=>"not_analyzed", "ignore_above"=>256}, "raw"=>{"type"=>"keyword", "index"=>"not_analyzed", "ignore_above"=>256}}}}}], "properties"=>{"@timestamp"=>{"type"=>"date", "include_in_all"=>false}, "@version"=>{"type"=>"keyword", "include_in_all"=>false}, "geoip"=>{"dynamic"=>true, "properties"=>{"ip"=>{"type"=>"ip"}, "location"=>{"type"=>"geo_point"}, "latitude"=>{"type"=>"half_float"}, "longitude"=>{"type"=>"half_float"}}}, "dest_ip"=>{"type"=>"ip", "fields"=>{"raw"=>{"index"=>"not_analyzed", "type"=>"keyword"}, "keyword"=>{"index"=>"not_analyzed", "type"=>"keyword"}}}, "src_ip"=>{"type"=>"ip", "fields"=>{"raw"=>{"index"=>"not_analyzed", "type"=>"keyword"}, "keyword"=>{"index"=>"not_analyzed", "type"=>"keyword"}}}}}}}}
[2018-10-02T14:46:52,058][INFO ][logstash.outputs.elasticsearch] New Elasticsearch output {:class=>"LogStash::Outputs::ElasticSearch", :hosts=>["//127.0.0.1"]}
[2018-10-02T14:46:52,430][INFO ][logstash.filters.geoip   ] Using geoip database {:path=>"/usr/share/logstash/vendor/bundle/jruby/1.9/gems/logstash-filter-geoip-4.3.1-java/vendor/GeoLite2-City.mmdb"}
[2018-10-02T14:46:52,447][INFO ][logstash.filters.geoip   ] Using geoip database {:path=>"/usr/share/logstash/vendor/bundle/jruby/1.9/gems/logstash-filter-geoip-4.3.1-java/vendor/GeoLite2-City.mmdb"}
[2018-10-02T14:46:52,449][INFO ][logstash.pipeline        ] Starting pipeline {"id"=>"main", "pipeline.workers"=>4, "pipeline.batch.size"=>125, "pipeline.batch.delay"=>5, "pipeline.max_inflight"=>500}
[2018-10-02T14:46:52,620][INFO ][logstash.pipeline        ] Pipeline main started
[2018-10-02T14:46:52,698][INFO ][logstash.agent           ] Successfully started Logstash API endpoint {:port=>9600}

elasticsearch.log:

[2018-10-02T14:47:59,791][INFO ][o.e.c.m.MetaDataCreateIndexService] [_hC156Z] [logstash-ssh-2018.10.01] creating index, cause [auto(bulk api)], templates [logstash], shards [5]/[0], mappings [_default_]
[2018-10-02T14:48:02,343][INFO ][o.e.c.r.a.AllocationService] [_hC156Z] Cluster health status changed from [YELLOW] to [GREEN] (reason: [shards started [[logstash-ssh-2018.10.01][4]] ...]).
[2018-10-02T14:48:02,752][INFO ][o.e.c.m.MetaDataMappingService] [_hC156Z] [logstash-ssh-2018.10.01/jksfT3sTT9KfoZtjmVcG5Q] create_mapping [SELKS]
[2018-10-02T14:48:33,186][INFO ][o.e.c.m.MetaDataMappingService] [_hC156Z] [logstash-flow-2018.10.01/mG4GHIVTR6WXyCRw4FCUbw] update_mapping [SELKS]
[2018-10-02T14:48:39,662][INFO ][o.e.c.m.MetaDataMappingService] [_hC156Z] [logstash-ssh-2018.10.01/jksfT3sTT9KfoZtjmVcG5Q] update_mapping [SELKS]
[2018-10-02T14:48:39,849][INFO ][o.e.c.m.MetaDataMappingService] [_hC156Z] [logstash-http-2018.10.01/6aNe2GEQRBiA4uch7A2qsQ] update_mapping [SELKS]
[2018-10-02T14:48:55,983][INFO ][o.e.c.m.MetaDataMappingService] [_hC156Z] [logstash-http-2018.10.01/6aNe2GEQRBiA4uch7A2qsQ] update_mapping [SELKS]
[2018-10-02T14:49:04,403][INFO ][o.e.c.m.MetaDataMappingService] [_hC156Z] [logstash-alert-2018.10.01/pB3lLwcuSKi2JufbYVXLBw] update_mapping [SELKS]
[2018-10-02T14:49:34,498][INFO ][o.e.c.m.MetaDataMappingService] [_hC156Z] [logstash-http-2018.10.01/6aNe2GEQRBiA4uch7A2qsQ] update_mapping [SELKS]
[2018-10-02T14:49:39,044][INFO ][o.e.c.m.MetaDataMappingService] [_hC156Z] [logstash-http-2018.10.01/6aNe2GEQRBiA4uch7A2qsQ] update_mapping [SELKS]
[2018-10-02T14:49:49,342][INFO ][o.e.c.m.MetaDataMappingService] [_hC156Z] [logstash-http-2018.10.01/6aNe2GEQRBiA4uch7A2qsQ] update_mapping [SELKS]
[2018-10-02T14:50:56,235][INFO ][o.e.c.m.MetaDataMappingService] [_hC156Z] [logstash-http-2018.10.01/6aNe2GEQRBiA4uch7A2qsQ] update_mapping [SELKS]
[2018-10-02T14:50:56,850][INFO ][o.e.c.m.MetaDataMappingService] [_hC156Z] [logstash-alert-2018.10.01/pB3lLwcuSKi2JufbYVXLBw] update_mapping [SELKS]
[2018-10-02T14:50:57,581][INFO ][o.e.c.m.MetaDataMappingService] [_hC156Z] [logstash-tls-2018.10.01/n2s7IcJ8T5-9qYFiiJlGtw] update_mapping [SELKS]
[2018-10-02T14:52:04,430][INFO ][o.e.c.m.MetaDataMappingService] [_hC156Z] [logstash-http-2018.10.01/6aNe2GEQRBiA4uch7A2qsQ] update_mapping [SELKS]
[2018-10-02T14:52:43,126][INFO ][o.e.c.m.MetaDataMappingService] [_hC156Z] [logstash-tls-2018.10.01/n2s7IcJ8T5-9qYFiiJlGtw] update_mapping [SELKS]
[2018-10-02T14:54:00,457][INFO ][o.e.c.m.MetaDataMappingService] [_hC156Z] [logstash-http-2018.10.01/6aNe2GEQRBiA4uch7A2qsQ] update_mapping [SELKS]
[2018-10-02T14:54:12,769][INFO ][o.e.c.m.MetaDataMappingService] [_hC156Z] [logstash-alert-2018.10.01/pB3lLwcuSKi2JufbYVXLBw] update_mapping [SELKS]
[2018-10-02T14:57:14,953][INFO ][o.e.c.m.MetaDataMappingService] [_hC156Z] [logstash-flow-2018.10.01/mG4GHIVTR6WXyCRw4FCUbw] update_mapping [SELKS]
[2018-10-02T15:00:27,555][INFO ][o.e.c.m.MetaDataMappingService] [_hC156Z] [logstash-smtp-2018.10.01/vRIkiM_hToyg7e-R8bLEyA] update_mapping [SELKS]
[2018-10-02T15:00:28,012][INFO ][o.e.c.m.MetaDataMappingService] [_hC156Z] [logstash-fileinfo-2018.10.01/WIas5cu0RXO5MWhmNQ5tPw] update_mapping [SELKS]
[2018-10-02T15:02:48,806][INFO ][o.e.c.m.MetaDataMappingService] [_hC156Z] [logstash-dns-2018.10.01/nepUayKMQW-lxoxYqO4B2w] update_mapping [SELKS]
[2018-10-02T15:03:15,287][INFO ][o.e.c.m.MetaDataMappingService] [_hC156Z] [logstash-ssh-2018.10.01/jksfT3sTT9KfoZtjmVcG5Q] update_mapping [SELKS]
[2018-10-02T15:04:16,938][INFO ][o.e.c.m.MetaDataMappingService] [_hC156Z] [logstash-http-2018.10.01/6aNe2GEQRBiA4uch7A2qsQ] update_mapping [SELKS]
[2018-10-02T15:05:39,120][INFO ][o.e.c.m.MetaDataMappingService] [_hC156Z] [logstash-tls-2018.10.01/n2s7IcJ8T5-9qYFiiJlGtw] update_mapping [SELKS]
[2018-10-02T15:06:24,077][INFO ][o.e.c.m.MetaDataMappingService] [_hC156Z] [logstash-flow-2018.10.01/mG4GHIVTR6WXyCRw4FCUbw] update_mapping [SELKS]
[2018-10-02T15:06:50,597][INFO ][o.e.c.m.MetaDataMappingService] [_hC156Z] [logstash-http-2018.10.01/6aNe2GEQRBiA4uch7A2qsQ] update_mapping [SELKS]
[2018-10-02T15:08:03,289][INFO ][o.e.c.m.MetaDataMappingService] [_hC156Z] [logstash-alert-2018.10.01/pB3lLwcuSKi2JufbYVXLBw] update_mapping [SELKS]
[2018-10-02T15:14:06,166][INFO ][o.e.c.m.MetaDataMappingService] [_hC156Z] [logstash-http-2018.10.01/6aNe2GEQRBiA4uch7A2qsQ] update_mapping [SELKS]
[2018-10-02T15:15:06,843][INFO ][o.e.c.m.MetaDataMappingService] [_hC156Z] [logstash-http-2018.10.01/6aNe2GEQRBiA4uch7A2qsQ] update_mapping [SELKS]
[2018-10-02T15:17:47,325][INFO ][o.e.c.m.MetaDataMappingService] [_hC156Z] [logstash-http-2018.10.01/6aNe2GEQRBiA4uch7A2qsQ] update_mapping [SELKS]
[2018-10-02T15:17:47,495][INFO ][o.e.c.m.MetaDataMappingService] [_hC156Z] [logstash-fileinfo-2018.10.01/WIas5cu0RXO5MWhmNQ5tPw] update_mapping [SELKS]
[2018-10-02T15:19:11,916][INFO ][o.e.c.m.MetaDataMappingService] [_hC156Z] [logstash-http-2018.10.01/6aNe2GEQRBiA4uch7A2qsQ] update_mapping [SELKS]
[2018-10-02T15:19:51,015][INFO ][o.e.c.m.MetaDataMappingService] [_hC156Z] [logstash-alert-2018.10.01/pB3lLwcuSKi2JufbYVXLBw] update_mapping [SELKS]
[2018-10-02T15:31:37,855][INFO ][o.e.c.m.MetaDataMappingService] [_hC156Z] [logstash-http-2018.10.01/6aNe2GEQRBiA4uch7A2qsQ] update_mapping [SELKS]
[2018-10-02T15:55:28,085][INFO ][o.e.c.m.MetaDataMappingService] [_hC156Z] [logstash-alert-2018.10.01/pB3lLwcuSKi2JufbYVXLBw] update_mapping [SELKS]
[2018-10-02T16:06:40,683][INFO ][o.e.c.m.MetaDataMappingService] [_hC156Z] [logstash-http-2018.10.01/6aNe2GEQRBiA4uch7A2qsQ] update_mapping [SELKS]
[2018-10-02T16:17:58,006][INFO ][o.e.c.m.MetaDataMappingService] [_hC156Z] [logstash-smtp-2018.10.01/vRIkiM_hToyg7e-R8bLEyA] update_mapping [SELKS]
[2018-10-02T16:56:26,927][INFO ][o.e.c.m.MetaDataMappingService] [_hC156Z] [logstash-http-2018.10.01/6aNe2GEQRBiA4uch7A2qsQ] update_mapping [SELKS]
[2018-10-02T17:15:32,610][INFO ][o.e.c.m.MetaDataMappingService] [_hC156Z] [logstash-alert-2018.10.01/pB3lLwcuSKi2JufbYVXLBw] update_mapping [SELKS]
[2018-10-02T17:21:13,584][INFO ][o.e.c.m.MetaDataMappingService] [_hC156Z] [logstash-smtp-2018.10.01/vRIkiM_hToyg7e-R8bLEyA] update_mapping [SELKS]
[2018-10-02T17:40:07,584][INFO ][o.e.c.m.MetaDataMappingService] [_hC156Z] [logstash-http-2018.10.01/6aNe2GEQRBiA4uch7A2qsQ] update_mapping [SELKS]
[2018-10-02T17:46:22,133][INFO ][o.e.c.m.MetaDataMappingService] [_hC156Z] [logstash-alert-2018.10.01/pB3lLwcuSKi2JufbYVXLBw] update_mapping [SELKS]

**Comment by pevma** [comment]
Have you tried to change the time span (form 6hrs to 2-7 days for example?) 

Also when you go to Kibana and go to the `Discovery` , select the `logstash-alert-*` indice tab    - you should see the alert events populating for the chosen period of time (last 6 hr/24hrs/2 days etc..) is that the case?

**Comment by dracmic** [comment]
:) Sorry pvema it appears that evelog cannot work in two places initially it worked and afterwards crashed .... I wanted also to process the alerts for inserting to exabgp with a python script found but what reads for now eve by socket. I did a reset again of all data, restart logstash and now appears the alerts, if the issue will appear again I will reply here.

**Comment by dracmic** [comment]
pvema, I found I think the issue but looked over logstash options and didn't find something to make him read from bottom of eve.json. I discovered resseting by mistake eve.json with the script mentioned ealier and afterwards I restarted with eve.json empty and it works. So in my opinion the eve.json file should be empty when restarting logstash.

**Comment by pevma** [comment]
Logstash has the  `since db` (inthe config template as well) - that is used to influence that behavior as well.

**Comment by dracmic** [comment]
Thanks for hint, didn't took that in consideration. Now i put that to /dev/null. From this morning works for 4 hours almost. Still thinking how to redo the logstash startup script to reset eve.json on startup because I am more used with old init system which used bash scripts than systemd

**Comment by pevma** [comment]
One thing you need to be careful though - is that when you restart it will start reading from the beginning of the log  file as well. I would recommend keeping it the way it is configured in SELKS
