### ISSUE TITLE
Selks-4.0rc1 : iface-list is wrong

### ISSUE THREAD

**Issue by Methraton** [StamusNetworks/SELKS#78]
I hope this is the right place to ask:
I’m pretty new to suricata in general and to scirius in particular: please be patient.
I just installed SELKS-4.0rc1-desktop on a physical device.
4 ethernet interfaces
	_enp4s0f0: sniffing
	enp4s0f1: sniffing
	eno1: 192.168.202.13/24 management
	eno2: unused_

I updated suricata.yaml with my interface names, no luck 
the list of sniffing interfaces is wrong:
_# suricatasc -c iface-list
{"message": {"count": 1, "ifaces": ["enp0s3"]}, "return": "OK"}_

I haven’t an interface enp0s3 !

I noticed that there is a  /etc/suricata/selks4-addin.yaml file, and it point to a enp0s3 interface.
If i remove enp0s3 for eno1 (for example) the output is correct
_# suricatasc -c iface-list
{"message": {"count": 1, "ifaces": ["eno1"]}, "return": "OK"}_
but I see nothing on the web interface: no events, no rules activity, no memory usage...
![immagine](https://user-images.githubusercontent.com/15027952/28213970-ad0d0dfc-68a8-11e7-916d-593789e47110.png)

Should I remove the selks4-addin.yaml file and configure only the suricata.yml file?
How to populate scirius web pages with data?

Thanks, in advance
Meth

**Comment by pevma** [comment]
I would suggest editing ` /etc/suricata/selks4-addin.yaml ` and putting the interface there - as it will override the settings in `suricata.yaml`. `selks4-addin.yaml ` contains customizations that are SELKS specific and as it is appended to `suricata.yaml` it overrides the defaults there.

You can simply run  - `/opt/selks/Scripts/Setup/setup-selks-ids-interface.sh` and enter the sniffing interface or use the desktop icon (if you are running the desktop edition).

As far as populating with data - do you have traffic on the sniffing interface?

**Comment by Methraton** [comment]
thanks for the quick answer:
after adding the configuration to selks4-addin.yaml
i have
```
#  suricatasc -c iface-list
{"message": {"count": 2, "ifaces": ["enp4s0f0", "enp4s0f1"]}, "return": "OK"}
```
The interfaces match.
I have traffic on the interfaces, but still no activity in scirius.
```
# tcpdump -ni enp4s0f0
tcpdump: verbose output suppressed, use -v or -vv for full protocol decode
listening on enp4s0f0, link-type EN10MB (Ethernet), capture size 262144 bytes
15:57:54.561773 IP x.y.z.237 > 224.0.0.18: VRRPv2, Advertisement, vrid 10, prio 0, authtype none, intvl 1s, length 36
15:57:54.642587 STP 802.1d, Config, Flags [none], bridge-id 4000.00:23:ae:bf:c4:1f.800f, length 43
15:57:54.739172 IP x.y.z.225 > 224.0.0.18: VRRPv2, Advertisement, vrid 1, prio 105, authtype simple, intvl 1s, length 20
15:57:55.562734 IP x.y.z.237 > 224.0.0.18: VRRPv2, Advertisement, vrid 10, prio 0, authtype none, intvl 1s, length 36
15:57:55.627192 IP x.y.z.225 > 224.0.0.18: VRRPv2, Advertisement, vrid 1, prio 105, authtype simple, intvl 1s, length 20
15:57:56.456683 IP x.y.z.225 > 224.0.0.18: VRRPv2, Advertisement, vrid 1, prio 105, authtype simple, intvl 1s, length 20
15:57:56.563710 IP x.y.z.237 > 224.0.0.18: VRRPv2, Advertisement, vrid 10, prio 0, authtype none, intvl 1s, length 36
^C15:57:56.641665 STP 802.1d, Config, Flags [none], bridge-id 4000.00:23:ae:bf:c4:1f.800f, length 43
15:57:56.673116 ARP, Request who-has x.y.z.232 tell x.y.z.225, length 46
15:57:57.365881 IP x.y.z.225 > 224.0.0.18: VRRPv2, Advertisement, vrid 1, prio 105, authtype simple, intvl 1s, length 20
# tcpdump -ni enp4s0f1
15:57:43.385671 IP v.w.t.138.55221 > x.y.z.236.8081: Flags [P.], seq 2253:2583, ack 159060, win 2049, length 330
15:57:43.388257 IP x.y.z.236.8081 > v.w.t.138.55221: Flags [P.], seq 159060:159150, ack 2583, win 4106, length 90
15:57:43.390888 IP v.w.t.138.55221 > x.y.z.236.8081: Flags [P.], seq 2583:3009, ack 159150, win 2049, length 426
15:57:43.392822 IP 194.177.73.254.80 > x.y.z.236.49821: Flags [S.], seq 1712329758, ack 75280914, win 14600, options [mss 1460,nop,nop,sackOK,nop,wscale 7], length 0
15:57:43.392955 IP x.y.z.236.49821 > 194.177.73.254.80: Flags [.], ack 1, win 256, options [nop,nop,sack 1 {0:1}], length 0
15:57:43.413466 IP x.y.z.236.1194 > v.w.t.138.51748: UDP, length 85
15:57:43.415293 IP x.y.z.236.8081 > v.w.t.138.55221: Flags [.], ack 3009, win 4104, length 0
15:57:43.421085 IP 173.192.82.194.443 > x.y.z.236.49222: Flags [P.], seq 1464128440:1464128471, ack 783008410, win 137, length 31
15:57:43.421451 IP x.y.z.236.49222 > 173.192.82.194.443: Flags [P.], seq 1:36, ack 31, win 251, length 35
15:57:43.429475 IP x.y.z.236.21987 > v.w.t.183.443: Flags [P.], seq 1876225577:1876226958, ack 2717289044, win 256, length 1381
15:57:43.429482 IP x.y.z.236.21987 > v.w.t.183.443: Flags [P.], seq 1381:1466, ack 1, win 256, length 85
15:57:43.431887 IP v.w.t.183.443 > x.y.z.236.21987: Flags [.], ack 1466, win 256, length 0
15:57:43.432658 IP x.y.z.236.30736 > 54.230.44.34.80: Flags [.], seq 543588051:543588052, ack 1398325681, win 256, length 1: HTTP
15:57:43.436808 IP x.y.z.236.1489 > 66.102.1.125.5222: Flags [P.], seq 1559701286:1559701316, ack 2661133397, win 257, length 30
15:57:43.443639 IP 54.230.44.34.80 > x.y.z.236.30736: Flags [.], ack 1, win 119, options [nop,nop,sack 1 {0:1}], length 0
15:57:43.453869 IP 66.102.1.125.5222 > x.y.z.236.1489: Flags [.], ack 30, win 286, length 0
15:57:43.458701 IP x.y.z.236.443 > 5.99.198.210.39931: Flags [P.], seq 240744690:240744761, ack 731198192, win 520, options [nop,nop,TS val 2016037023 ecr 561051141], length 71
```

**Comment by pevma** [comment]
Have you changed the hostname maybe ? (https://github.com/StamusNetworks/SELKS/wiki/Initial-Setup---HOSTNAME)

**Comment by Methraton** [comment]
Confirm: i see the graphs now!
One last thing: Elasticsearch is in yellow status, one shard is not assigned,
how can I investigate?

**Comment by pevma** [comment]
I think this is the `.kibana` shard. that is trying to replicate bit it is a one node cluster hence the yellow status. You can fix it by issuing on the command line :

> curl -XPUT 'localhost:9200/_settings' -d '{
> "index" : {
> "number_of_replicas" : 0
> }
> }'

**Comment by Methraton** [comment]
Perfect!
And what is the new procedure for updating the rules?
I uploaded a custom rule file as a source, added it to the default ruleset, and selected update.
The new rules are not applied until a _/usr/bin/python /opt/selks/scirius/manage.py  updatesuricata_ , but this is no more valid: how can I force a rules update?

**Comment by pevma** [comment]
You can manually update the rules from the command line - there is an example in "/etc/crontab" - or via the web interface under the "Suricata" tab.

**Comment by pevma** [comment]
Forgot to mention - the procedures above would apply/update and restart Suricata.

**Comment by pitoganzado** [comment]
@Methraton what change did you make in selks4-addin.yaml to add second NIC? Regards!

**Comment by pevma** [comment]
@pitoganzado   -please don't comment on closed issues :) - you are welcome to open one or ask on the selks mailing list.

I think this can help  - you just need to add another section in the `af-paket` section for that interface in the config - https://redmine.openinfosecfoundation.org/projects/suricata/repository/revisions/master/entry/suricata.yaml.in#L622
